{
  "env_id": "healthcare_operations_agent",
  "schema_version": 1,
  "tools": [
    {
      "default_page_size": 20,
      "filter_fields": {
        "appointment_id": "appointment_id",
        "area_id": "area_id",
        "device_id": "device_id",
        "entity_id": "entity_id",
        "home_id": "home_id",
        "incident_id": "incident_id",
        "occupant_id": "occupant_id",
        "order_id": "order_id",
        "patient_id": "patient_id",
        "plan_id": "plan_id",
        "practitioner_id": "practitioner_id",
        "record_id": "record_id",
        "request_id": "request_id",
        "rule_type": "rule_type",
        "snapshot_id": "snapshot_id"
      },
      "input_schema": {
        "additionalProperties": false,
        "properties": {
          "appointment_id": {
            "type": "string"
          },
          "area_id": {
            "type": "string"
          },
          "device_id": {
            "type": "string"
          },
          "entity_id": {
            "type": "string"
          },
          "home_id": {
            "type": "string"
          },
          "incident_id": {
            "type": "string"
          },
          "occupant_id": {
            "type": "string"
          },
          "order_id": {
            "type": "string"
          },
          "page": {
            "minimum": 1,
            "type": "integer"
          },
          "page_size": {
            "maximum": 50,
            "minimum": 1,
            "type": "integer"
          },
          "patient_id": {
            "type": "string"
          },
          "plan_id": {
            "type": "string"
          },
          "practitioner_id": {
            "type": "string"
          },
          "query": {
            "type": "string"
          },
          "record_id": {
            "type": "string"
          },
          "request_id": {
            "type": "string"
          },
          "rule_type": {
            "type": "string"
          },
          "snapshot_id": {
            "type": "string"
          }
        },
        "type": "object"
      },
      "max_page_size": 50,
      "name": "action_preview",
      "output_schema": {
        "additionalProperties": true,
        "properties": {
          "complete": {
            "type": "boolean"
          },
          "page": {
            "type": "integer"
          },
          "page_size": {
            "type": "integer"
          },
          "results": {
            "items": {
              "type": "object"
            },
            "type": "array"
          },
          "source_refs": {
            "items": {
              "type": "string"
            },
            "type": "array"
          },
          "status": {
            "enum": [
              "ok",
              "error"
            ]
          },
          "tool": {
            "const": "action_preview"
          },
          "total_results": {
            "type": "integer"
          },
          "world_snapshot_version": {
            "type": "string"
          }
        },
        "required": [
          "status",
          "tool"
        ],
        "type": "object"
      },
      "record_types": [
        "action_preview"
      ],
      "returns_source_metadata": true,
      "search_fields": [
        "name",
        "title",
        "summary"
      ]
    },
    {
      "default_page_size": 20,
      "filter_fields": {
        "appointment_id": "appointment_id",
        "area_id": "area_id",
        "device_id": "device_id",
        "entity_id": "entity_id",
        "home_id": "home_id",
        "incident_id": "incident_id",
        "occupant_id": "occupant_id",
        "order_id": "order_id",
        "patient_id": "patient_id",
        "plan_id": "plan_id",
        "practitioner_id": "practitioner_id",
        "record_id": "record_id",
        "request_id": "request_id",
        "rule_type": "rule_type",
        "snapshot_id": "snapshot_id"
      },
      "input_schema": {
        "additionalProperties": false,
        "properties": {
          "appointment_id": {
            "type": "string"
          },
          "area_id": {
            "type": "string"
          },
          "device_id": {
            "type": "string"
          },
          "entity_id": {
            "type": "string"
          },
          "home_id": {
            "type": "string"
          },
          "incident_id": {
            "type": "string"
          },
          "occupant_id": {
            "type": "string"
          },
          "order_id": {
            "type": "string"
          },
          "page": {
            "minimum": 1,
            "type": "integer"
          },
          "page_size": {
            "maximum": 50,
            "minimum": 1,
            "type": "integer"
          },
          "patient_id": {
            "type": "string"
          },
          "plan_id": {
            "type": "string"
          },
          "practitioner_id": {
            "type": "string"
          },
          "query": {
            "type": "string"
          },
          "record_id": {
            "type": "string"
          },
          "request_id": {
            "type": "string"
          },
          "rule_type": {
            "type": "string"
          },
          "snapshot_id": {
            "type": "string"
          }
        },
        "type": "object"
      },
      "max_page_size": 50,
      "name": "active_medications_read",
      "output_schema": {
        "additionalProperties": true,
        "properties": {
          "complete": {
            "type": "boolean"
          },
          "page": {
            "type": "integer"
          },
          "page_size": {
            "type": "integer"
          },
          "results": {
            "items": {
              "type": "object"
            },
            "type": "array"
          },
          "source_refs": {
            "items": {
              "type": "string"
            },
            "type": "array"
          },
          "status": {
            "enum": [
              "ok",
              "error"
            ]
          },
          "tool": {
            "const": "active_medications_read"
          },
          "total_results": {
            "type": "integer"
          },
          "world_snapshot_version": {
            "type": "string"
          }
        },
        "required": [
          "status",
          "tool"
        ],
        "type": "object"
      },
      "record_types": [
        "medication_statement"
      ],
      "returns_source_metadata": true,
      "search_fields": [
        "name",
        "title",
        "summary"
      ]
    },
    {
      "default_page_size": 20,
      "filter_fields": {
        "appointment_id": "appointment_id",
        "area_id": "area_id",
        "device_id": "device_id",
        "entity_id": "entity_id",
        "home_id": "home_id",
        "incident_id": "incident_id",
        "occupant_id": "occupant_id",
        "order_id": "order_id",
        "patient_id": "patient_id",
        "plan_id": "plan_id",
        "practitioner_id": "practitioner_id",
        "record_id": "record_id",
        "request_id": "request_id",
        "rule_type": "rule_type",
        "snapshot_id": "snapshot_id"
      },
      "input_schema": {
        "additionalProperties": false,
        "properties": {
          "appointment_id": {
            "type": "string"
          },
          "area_id": {
            "type": "string"
          },
          "device_id": {
            "type": "string"
          },
          "entity_id": {
            "type": "string"
          },
          "home_id": {
            "type": "string"
          },
          "incident_id": {
            "type": "string"
          },
          "occupant_id": {
            "type": "string"
          },
          "order_id": {
            "type": "string"
          },
          "page": {
            "minimum": 1,
            "type": "integer"
          },
          "page_size": {
            "maximum": 50,
            "minimum": 1,
            "type": "integer"
          },
          "patient_id": {
            "type": "string"
          },
          "plan_id": {
            "type": "string"
          },
          "practitioner_id": {
            "type": "string"
          },
          "query": {
            "type": "string"
          },
          "record_id": {
            "type": "string"
          },
          "request_id": {
            "type": "string"
          },
          "rule_type": {
            "type": "string"
          },
          "snapshot_id": {
            "type": "string"
          }
        },
        "type": "object"
      },
      "max_page_size": 50,
      "name": "allergy_intolerance_read",
      "output_schema": {
        "additionalProperties": true,
        "properties": {
          "complete": {
            "type": "boolean"
          },
          "page": {
            "type": "integer"
          },
          "page_size": {
            "type": "integer"
          },
          "results": {
            "items": {
              "type": "object"
            },
            "type": "array"
          },
          "source_refs": {
            "items": {
              "type": "string"
            },
            "type": "array"
          },
          "status": {
            "enum": [
              "ok",
              "error"
            ]
          },
          "tool": {
            "const": "allergy_intolerance_read"
          },
          "total_results": {
            "type": "integer"
          },
          "world_snapshot_version": {
            "type": "string"
          }
        },
        "required": [
          "status",
          "tool"
        ],
        "type": "object"
      },
      "record_types": [
        "allergy_intolerance"
      ],
      "returns_source_metadata": true,
      "search_fields": [
        "name",
        "title",
        "summary"
      ]
    },
    {
      "default_page_size": 20,